{
  "schema_version": "2.0",
  "ruleset_version": "2.0",
  "task_id": "fixture_draft_assessment_not_finalized",
  "assessment_status": "draft",
  "coverage": {
    "confidence": "high",
    "complete": true,
    "gaps": []
  },
  "candidates": [
    {
      "candidate_id": "draft_active_design_strong_overlap",
      "module": "appearance_design",
      "record_kind": "right_record",
      "legal_materiality": "risk_bearing",
      "risk_driver_eligible": true,
      "authority_tier": "official",
      "evidence_role": "risk_driver",
      "target_jurisdiction": "US",
      "right_jurisdiction": "US",
      "evidence_refs": [
        "evidence://uspto/draft-design"
      ],
      "verification_refs": [
        "verification://official/draft-design"
      ],
      "evidence_cluster_id": "right_draft_design",
      "independence_group": "right_draft_design",
      "factors": {
        "right_status": "active",
        "official_record_verified": true,
        "same_product_category": true,
        "complete_official_images": true,
        "claimed_portions": ["完整商品外观"],
        "dominant_shared_features": ["整体轮廓高度一致"],
        "dominant_differences": [],
        "difference_effect": "none",
        "overall_visual_impression": "high",
        "authorization_status": "unknown"
      }
    }
  ],
  "modules": [
    {
      "module": "appearance_design",
      "assessability": "assessable",
      "confidence": "high",
      "candidate_ids": [
        "draft_active_design_strong_overlap"
      ],
      "reasoning": "发现层已有强候选，但 Assessment 尚未最终确认。"
    },
    {
      "module": "utility_patent",
      "assessability": "assessable",
      "confidence": "high",
      "candidate_ids": [],
      "provenance_complete": false,
      "reasoning": "本验收场景未提供该模块的独立风险驱动候选。"
    },
    {
      "module": "pending_patent",
      "assessability": "assessable",
      "confidence": "high",
      "candidate_ids": [],
      "provenance_complete": false,
      "reasoning": "本验收场景未提供该模块的独立风险驱动候选。"
    },
    {
      "module": "word_mark",
      "assessability": "assessable",
      "confidence": "high",
      "candidate_ids": [],
      "provenance_complete": false,
      "reasoning": "本验收场景未提供该模块的独立风险驱动候选。"
    },
    {
      "module": "figurative_mark",
      "assessability": "assessable",
      "confidence": "high",
      "candidate_ids": [],
      "provenance_complete": false,
      "reasoning": "本验收场景未提供该模块的独立风险驱动候选。"
    },
    {
      "module": "trade_dress",
      "assessability": "assessable",
      "confidence": "high",
      "candidate_ids": [],
      "provenance_complete": false,
      "reasoning": "本验收场景未提供该模块的独立风险驱动候选。"
    },
    {
      "module": "copyright_creative_ip",
      "assessability": "assessable",
      "confidence": "high",
      "candidate_ids": [],
      "provenance_complete": false,
      "reasoning": "本验收场景未提供该模块的独立风险驱动候选。"
    },
    {
      "module": "enforcement_public_signals",
      "assessability": "assessable",
      "confidence": "high",
      "candidate_ids": [],
      "provenance_complete": false,
      "reasoning": "本验收场景未提供该模块的独立风险驱动候选。"
    }
  ],
  "review": {
    "fact_conflicts": []
  }
}
