{
  "schema_version": "2.0",
  "ruleset_version": "2.0",
  "task_id": "fixture_evidence_gap_does_not_raise_risk",
  "assessment_status": "final",
  "coverage": {
    "confidence": "low",
    "complete": false,
    "gaps": [
      {
        "code": "IMAGE_COVERAGE_LIMITED",
        "module": "appearance_design",
        "detail": "完整官方图组尚未取得。",
        "blocking": true
      }
    ]
  },
  "candidates": [
    {
      "candidate_id": "design_incomplete_images",
      "module": "appearance_design",
      "record_kind": "right_record",
      "legal_materiality": "unresolved",
      "risk_driver_eligible": false,
      "authority_tier": "unknown",
      "evidence_role": "context",
      "evidence_refs": [
        "evidence://provider/design-incomplete"
      ],
      "verification_refs": [],
      "evidence_cluster_id": "right_design_incomplete",
      "independence_group": "right_design_incomplete",
      "factors": {
        "right_status": "unknown",
        "official_record_verified": false,
        "same_product_category": true,
        "complete_official_images": false,
        "overall_visual_impression": "unknown",
        "authorization_status": "unknown"
      }
    }
  ],
  "modules": [
    {
      "module": "appearance_design",
      "assessability": "not_assessable",
      "confidence": "low",
      "candidate_ids": [
        "design_incomplete_images"
      ],
      "reasoning": "候选状态和完整图组均未核验，不能形成实体风险结论。"
    },
    {
      "module": "utility_patent",
      "assessability": "assessable",
      "confidence": "high",
      "candidate_ids": [],
      "provenance_complete": false,
      "reasoning": "本验收场景未提供该模块的独立风险驱动候选。"
    },
    {
      "module": "pending_patent",
      "assessability": "assessable",
      "confidence": "high",
      "candidate_ids": [],
      "provenance_complete": false,
      "reasoning": "本验收场景未提供该模块的独立风险驱动候选。"
    },
    {
      "module": "word_mark",
      "assessability": "assessable",
      "confidence": "high",
      "candidate_ids": [],
      "provenance_complete": false,
      "reasoning": "本验收场景未提供该模块的独立风险驱动候选。"
    },
    {
      "module": "figurative_mark",
      "assessability": "assessable",
      "confidence": "high",
      "candidate_ids": [],
      "provenance_complete": false,
      "reasoning": "本验收场景未提供该模块的独立风险驱动候选。"
    },
    {
      "module": "trade_dress",
      "assessability": "assessable",
      "confidence": "high",
      "candidate_ids": [],
      "provenance_complete": false,
      "reasoning": "本验收场景未提供该模块的独立风险驱动候选。"
    },
    {
      "module": "copyright_creative_ip",
      "assessability": "assessable",
      "confidence": "high",
      "candidate_ids": [],
      "provenance_complete": false,
      "reasoning": "本验收场景未提供该模块的独立风险驱动候选。"
    },
    {
      "module": "enforcement_public_signals",
      "assessability": "assessable",
      "confidence": "high",
      "candidate_ids": [],
      "provenance_complete": false,
      "reasoning": "本验收场景未提供该模块的独立风险驱动候选。"
    }
  ],
  "review": {
    "fact_conflicts": []
  }
}
